事業所名称,事業所郵便番号,事業所所在地,電話番号,FAX番号,事業開始年月日
わぁくワーク,564-0027,大阪府吹田市朝日町5番32号 摂津ﾋﾞﾙ4階,06-6381-7671,06-6383-6925,令和2年10月1日
学び場 パレット,564-0063,大阪府吹田市江坂町二丁目2番9号紙谷第7ﾋﾞﾙ201号室,06-6310-1658,06-6310-1659,令和4年11月1日
就労支援事業所フレイ,564-0045,大阪府吹田市金田町5番39号,06-6155-8806,06-6310-8860,令和5年4月1日
このゆびとまれ,564-0036,大阪府吹田市寿町一丁目4番28号,06-6317-5003,06-6317-5003,平成28年4月1日
サポートセンターフルハウス,565-0842,大阪府吹田市千里山東二丁目22番14号ﾗﾎﾟｰﾙ千里山201号､16号2階,06-6339-6760,,平成28年1月1日
自立センターえさか,564-0051,大阪府吹田市豊津町18番37号 江坂ﾋﾞｼﾞﾈｽｿﾞｰﾝ201･503･603･703,06-6190-5413,06-6190-5412,平成29年4月1日