2713304117,デイサービスセンターお湯～とぴあ,06-6633-7180,06-6633-7180,557-0016,大阪市西成区花園北二丁目４番５号　シャンブル西成１　１０１号室,株式会社ゆーとぴあ,○,○,○,○,30,,2019/06/01,,○
2713300677,西成障害者会館,06-6562-5800,06-6562-6677,557-0025,大阪市西成区長橋三丁目２番２７号　,社会福祉法人ヒューマンライツ福祉協会,○,○,○,○,40,,2007/04/01,,
2713304836,生活介護アイビー,06-7162-3044,06-7176-0415,557-0025,大阪市西成区長橋二丁目６番４－４０１・５０１号　 ,合同会社Ｍ＆Ｍ,○,○,○,○,40,,2021/07/01,,
2713304620,生活介護事業所らぶりーハウス,06-6616-7466,06-6616-7467,557-0033,大阪市西成区梅南三丁目６番９号　 ,有限会社　ＬＯＶＥＬＹ,○,○,○,○,20,,2021/03/01,,
2713300818,デーセンター夢飛行,06-6659-6612,06-6659-6612,557-0042,大阪市西成区岸里東一丁目５番３号　 ,社会福祉法人　ゆうのゆう,○,,,,31,,2008/01/01,,
2713303317,はっぴーはーと,06-4703-3918,06-4703-3919,557-0042,大阪市西成区岸里東二丁目１０番１９号　 ,株式会社ＨＡＰＰＹ,○,○,○,○,20,,2017/04/01,,
2713301485,サポートセンターあるす,06-4398-0073,06-4398-0072,557-0043,大阪市西成区玉出東二丁目２番２９号　 ,有限会社守成堂,○,○,○,○,6,○,2011/08/01,,
2713305270,ここあ,06-4398-3065,06-4398-9520,557-0043,大阪市西成区玉出東一丁目１４番１２号　 ,合同会社ジェイスリー,○,○,○,○,20,,2022/04/01,,
2713305288,ワーカウトＮ’ｓ岸里玉出,06-7850-6771,06-7850-6771,557-0043,大阪市西成区玉出東二丁目３番３２号　岸里玉出駅前ビル２階,株式会社リヴェルテ,○,○,○,,20,,2022/04/01,,
2713306344,りらいず＋,06-6654-6586,06-6654-6587,557-0045,大阪市西成区玉出西二丁目１４－１８　 ,合同会社ジェイスリー,○,○,○,○,20,,2024/04/01,,
2713302210,ナンクルナイサァー　くくる,06-4398-7971,06-4398-7972,557-0051,大阪市西成区橘一丁目３番５号　 ,有限会社ナンクルナイサァーケアネット,○,○,○,,20,,2013/04/01,,
2713305585,ハルデイサービス千本,06-6653-7515,06-6653-7515,557-0053,大阪市西成区千本北二丁目１番３号　 ,株式会社　ケアジャパン,○,○,○,○,18,,2022/12/01,,○
2713302780,せせらぎ,06-6652-7237,06-6652-7237,557-0053,大阪市西成区千本北二丁目１番３号　 ,株式会社　未来,○,○,○,○,20,,2015/06/01,,
2713305106,はっぴーがーでん,06-4703-3918,06-4703-3919,557-0053,大阪市西成区千本北二丁目１７番１号　 ,株式会社ＨＡＰＰＹ,○,○,○,○,10,○,2022/01/01,,
2713304349,ひだまりの家,06-6656-1151,06-6656-1152,557-0055,大阪市西成区千本南一丁目３番１４号　朝日プラザ岸里第１　１０４号,一般社団法人ひだまりの家,○,○,○,○,6,○,2020/02/01,,
2713305304,生活介護ぜろ,06-6654-9200,06-6654-9205,557-0055,大阪市西成区千本南一丁目１番１６号　 ,株式会社　ニュービレッジ,○,○,○,○,6,○,2023/05/01,,
2713305353,ＣＬＡＮ津守,06-6561-8551,06-6561-8552,557-0061,大阪市西成区北津守四丁目８番１０号　 ,株式会社ＣＬＡＮ,○,○,○,○,20,,2022/06/01,,
2713303010,生活介護ジヨン,06-4398-3838,06-4398-3838,557-0062,大阪市西成区津守三丁目５番２７号　 ,株式会社ジヨン,,○,○,,10,○,2016/04/01,,
2713301469,第一博愛,06-6656-7001,06-6656-7006,557-0063,大阪市西成区南津守一丁目４番７号　,社会福祉法人　枚方療育園,,○,,,100,,2010/11/01,,
2713301477,第二博愛,06-6656-7001,06-6656-7006,557-0063,大阪市西成区南津守一丁目４番７号　,社会福祉法人　枚方療育園,,○,,,60,,2010/11/01,,
2713302699,ナンクルナイサァ－ひので,06-6661-0713,06-7655-5545,557-0063,大阪市西成区南津守三丁目３番２２号　 ,有限会社ナンクルナイサァーケアネット,○,○,○,○,20,,2015/03/01,,
2715801094,さらら,06-6710-4582,06-7896-8246,581-0052,八尾市竹渕五丁目２８番９号　,ＮＰＯ法人　ピアエール,○,○,○,○,15,,2009/04/01,ＮＰО法人ピアエール加美作業所,
